医院名称,科室名称,科室所属学科一,科室图片名称,科室图片链接,科室简介
武警后勤学院附属医院 ,儿科,儿科,,无,"儿科是集医疗、教学、科研为一体的学科。现有医师10名，其中博士1名、硕士3名、副高职称以上人员4名；护士12名，其中主管护师1名。
儿科设普通诊室、专家诊室、新生儿室、新生儿查体室、输液留观室、隔离留观室、抢救室、注射配药室、无痛皮试及雾化室。
科室拥有微量血糖检测仪、心电图机、BP88型多参数病人监护仪、N-250无创脉搏血氧心电监护仪、电脑微量输液泵、双道微量注射泵、远红外线辐射抢救台、多功能婴儿培养箱、新生儿黄疸治疗仪/箱、Bilisoft光疗设备（光纤毯）、除颤机、德国STEPHAN CPAP-A系统、复苏抢救设备、压缩雾化吸入机、红外线耳式体温计、无创经皮测胆仪、快速过敏皮试仪等先进仪器。
开展儿科急危重症抢救；呼吸、消化系统疾病的诊治；儿童支气管哮喘、小儿咳嗽、毛细支气管炎、喘息性支气管炎等的雾化吸入治疗；新生儿疾病的诊治（新生儿黄疸、新生儿血型不合性溶血病、新生儿咽下综合征等）；对螨虫过敏患儿，舌下含服尘螨滴剂进行针对过敏源的脱敏治疗；过敏性疾病的过敏源检查；婴儿42天查体；宏量元素（钙、镁）、微量元素（锌、铜、铁）及血铅的测定；贫血患儿的筛查；医疗护理咨询等。护理方面开展无痛皮试、桡动脉、颞动脉、股动脉等部位采血，外周静脉留置针穿刺输液等技术。
儿科服务宗旨""尽心尽力诊治，全心全意服务""。"
武警后勤学院附属医院 ,肿瘤内科,肿瘤科,,无, 肿瘤内科是天津首家大型肿瘤综合治疗中心，引进头部伽玛刀、体部伽玛刀、直线加速器、热疗机等国际尖端肿瘤治疗设备，能为患者提供精确放疗、化疗、热疗、生物疗及中医疗等综合性治疗。头部伽玛刀开展颅内肿瘤、脑动经脉畸形和脑功能性疾病的治疗；体部伽玛刀治疗全身颅脑以外的系统器官肿瘤，血管性疾病和前列腺增生的治疗；直线加速器配合头、体伽玛刀治疗各种多发性、弥散性恶性肿瘤，为此组合成多功能、全方位的放射治疗系统，达到最佳的治疗方案和治疗效果。